{
  "schema_version": "1.0.0",
  "id": "basico",
  "name": "Básico",
  "font": { "family": "Noto Sans", "weight": 800, "file": null },
  "colors": {
    "sung": "#FFD400",
    "unsung": "#FFFFFF",
    "outline": "#000000",
    "shadow": "#00000099",
    "box": null
  },
  "layout": { "visible_lines": 2, "position": "bottom", "font_size": 0.06, "line_spacing": 1.3 },
  "animation": { "fill": "wipe", "countdown_min_gap": 5.0 }
}
